{
  "schemaVersion": "1.0.0",
  "markets": [
    {
      "marketId": "market-cra-reporting",
      "name": "Cyber Resilience Act vulnerability and incident reporting",
      "phase": "P4_CUTOVER",
      "phaseConfidence": "HIGH",
      "status": "ACTIVE",
      "waitTrigger": null,
      "valueNow": ["READINESS", "DATA_PREPARATION", "INTEGRATION"],
      "valueNext": ["EXCEPTION_HANDLING", "OBSERVABILITY", "AUDIT"],
      "informationValue": "HIGH",
      "currentStartupValue": "MEDIUM",
      "observedAt": "2026-08-13T12:20:00Z",
      "dependencyRefs": ["dep-eu-cra-reporting"],
      "ecosystemRefs": ["eco-cra-single-reporting-platform"],
      "ideaRefs": ["idea-401"],
      "sourceRefs": ["s83", "s96", "s108", "s184"]
    },
    {
      "marketId": "market-eu-consumer-repair",
      "name": "EU consumer repair routing and after-sales coordination",
      "phase": "P3_MIGRATION",
      "phaseConfidence": "MEDIUM",
      "status": "WAIT_FOR_TRIGGER",
      "waitTrigger": "European Repair Platform workflow and integration boundary becomes observable",
      "valueNow": ["READINESS", "MAPPING"],
      "valueNext": ["INTEGRATION", "EXCEPTION_HANDLING", "VERTICAL_WORKFLOW"],
      "informationValue": "HIGH",
      "currentStartupValue": "WAIT",
      "observedAt": "2026-08-13T12:20:00Z",
      "dependencyRefs": [],
      "ecosystemRefs": [],
      "ideaRefs": ["idea-264", "idea-295", "idea-371"],
      "sourceRefs": ["s101", "s185"]
    },
    {
      "marketId": "market-france-einvoicing",
      "name": "France B2B e-invoicing and e-reporting platform ecosystem",
      "phase": "P4_CUTOVER",
      "phaseConfidence": "HIGH",
      "status": "REASSESS",
      "waitTrigger": null,
      "valueNow": ["READINESS", "MAPPING", "INTEGRATION", "CONFORMANCE"],
      "valueNext": ["SWITCHING", "EXCEPTION_HANDLING", "OBSERVABILITY"],
      "informationValue": "HIGH",
      "currentStartupValue": "LOW",
      "observedAt": "2026-08-13T12:20:00Z",
      "dependencyRefs": [],
      "ecosystemRefs": [],
      "ideaRefs": ["idea-215"],
      "sourceRefs": ["s190", "s191", "s193", "s194"]
    },
    {
      "marketId": "market-eu-catch-imports",
      "name": "EU seafood CATCH import-certificate workflow",
      "phase": "P6_OPERATIONAL_SCALE",
      "phaseConfidence": "HIGH",
      "status": "ACTIVE",
      "waitTrigger": null,
      "valueNow": ["CONFORMANCE", "EXCEPTION_HANDLING"],
      "valueNext": ["OBSERVABILITY", "ANALYTICS", "VERTICAL_WORKFLOW"],
      "informationValue": "HIGH",
      "currentStartupValue": "MEDIUM",
      "observedAt": "2026-08-13T12:20:00Z",
      "dependencyRefs": [],
      "ecosystemRefs": [],
      "ideaRefs": ["idea-376"],
      "sourceRefs": ["s192", "s195"]
    },
    {
      "marketId": "market-ehds-secondary-use",
      "name": "EHDS secondary-use dataset discovery and access",
      "phase": "P2_PREPARATION",
      "phaseConfidence": "HIGH",
      "status": "WAIT_FOR_TRIGGER",
      "waitTrigger": "Implementing acts and representative national catalogue metadata make feasibility testable",
      "valueNow": ["READINESS", "DATA_PREPARATION", "MAPPING"],
      "valueNext": ["DATA_QUALITY", "INTEGRATION", "CONFORMANCE", "VERTICAL_WORKFLOW"],
      "informationValue": "HIGH",
      "currentStartupValue": "WAIT",
      "observedAt": "2026-08-13T12:20:00Z",
      "dependencyRefs": [],
      "ecosystemRefs": [],
      "ideaRefs": ["idea-379"],
      "sourceRefs": ["s123", "s188", "s189", "s196"]
    },
    {
      "marketId": "market-eu-rail-telematics",
      "name": "EU railway passenger and freight telematics interoperability",
      "phase": "P3_MIGRATION",
      "phaseConfidence": "MEDIUM",
      "status": "REASSESS",
      "waitTrigger": null,
      "valueNow": ["MAPPING", "MIGRATION", "INTEGRATION", "CONFORMANCE"],
      "valueNext": ["EXCEPTION_HANDLING", "OBSERVABILITY", "AUDIT"],
      "informationValue": "HIGH",
      "currentStartupValue": "UNKNOWN",
      "observedAt": "2026-08-13T12:50:00Z",
      "dependencyRefs": ["dep-eu-rail-capacity-2026-1184"],
      "ecosystemRefs": [],
      "ideaRefs": [],
      "sourceRefs": ["s198"]
    },
    {
      "marketId": "market-us-large-load-interconnection",
      "name": "US large-load transmission interconnection readiness",
      "phase": "P3_MIGRATION",
      "phaseConfidence": "MEDIUM",
      "status": "REASSESS",
      "waitTrigger": null,
      "valueNow": ["READINESS", "DATA_PREPARATION", "MAPPING"],
      "valueNext": ["INTEGRATION", "OBSERVABILITY", "AUDIT"],
      "informationValue": "HIGH",
      "currentStartupValue": "MEDIUM",
      "observedAt": "2026-08-13T14:11:00Z",
      "dependencyRefs": [],
      "ecosystemRefs": [],
      "ideaRefs": ["idea-395", "idea-396"],
      "sourceRefs": ["s199", "s272"]
    },
    {
      "marketId": "market-eu-critical-medicine-procurement",
      "name": "EU critical-medicine resilience procurement",
      "phase": "P2_PREPARATION",
      "phaseConfidence": "HIGH",
      "status": "WAIT_FOR_TRIGGER",
      "waitTrigger": "Formal adoption and buyer-specific resilience criteria or guidance become observable",
      "valueNow": ["POLICY_INTERPRETATION", "READINESS", "DATA_PREPARATION"],
      "valueNext": ["MAPPING", "INTEGRATION", "CONFORMANCE", "AUDIT"],
      "informationValue": "HIGH",
      "currentStartupValue": "WAIT",
      "observedAt": "2026-08-13T14:11:00Z",
      "dependencyRefs": [],
      "ecosystemRefs": [],
      "ideaRefs": ["idea-377"],
      "sourceRefs": ["s202"]
    },
    {
      "marketId": "market-eu-space-safety-evidence",
      "name": "EU satellite safety, debris, and lifecycle evidence",
      "phase": "P2_PREPARATION",
      "phaseConfidence": "MEDIUM",
      "status": "WAIT_FOR_TRIGGER",
      "waitTrigger": "EU Space Act text is formally adopted and operator change-control evidence requirements become testable",
      "valueNow": ["POLICY_INTERPRETATION", "READINESS", "MAPPING"],
      "valueNext": ["INTEGRATION", "CONFORMANCE", "CERTIFICATION", "AUDIT"],
      "informationValue": "HIGH",
      "currentStartupValue": "WAIT",
      "observedAt": "2026-08-13T14:11:00Z",
      "dependencyRefs": [],
      "ecosystemRefs": [],
      "ideaRefs": ["idea-383"],
      "sourceRefs": ["s204", "s205", "s210"]
    },
    {
      "marketId": "market-eu-connected-product-data-access",
      "name": "EU connected-product and industrial-machine data access",
      "phase": "P5_CONFORMANCE",
      "phaseConfidence": "MEDIUM",
      "status": "REASSESS",
      "waitTrigger": null,
      "valueNow": ["MAPPING", "INTEGRATION", "CONFORMANCE"],
      "valueNext": ["EXCEPTION_HANDLING", "OBSERVABILITY", "VERTICAL_WORKFLOW"],
      "informationValue": "HIGH",
      "currentStartupValue": "LOW",
      "observedAt": "2026-08-13T15:05:00Z",
      "dependencyRefs": [],
      "ecosystemRefs": [],
      "ideaRefs": ["idea-276"],
      "sourceRefs": ["s211", "s212"]
    },
    {
      "marketId": "market-agentic-commerce-protocols",
      "name": "Agentic-commerce trust, authorization, and purchasing protocols",
      "phase": "P1_SPEC_FORMING",
      "phaseConfidence": "MEDIUM",
      "status": "WAIT_FOR_TRIGGER",
      "waitTrigger": "Interoperable B2B adoption exposes an unresolved long-tail supplier catalog, quote, terms, or exception boundary beyond trust and payment protocols",
      "valueNow": ["MAPPING", "INTEGRATION"],
      "valueNext": ["CONFORMANCE", "CERTIFICATION", "EXCEPTION_HANDLING", "VERTICAL_WORKFLOW"],
      "informationValue": "HIGH",
      "currentStartupValue": "WAIT",
      "observedAt": "2026-08-13T15:05:00Z",
      "dependencyRefs": [],
      "ecosystemRefs": [],
      "ideaRefs": ["idea-349", "idea-341"],
      "sourceRefs": ["s220", "s221", "s222", "s275"]
    },
    {
      "marketId": "market-eu-research-infrastructure-access",
      "name": "EU industrial access to research and technology infrastructures",
      "phase": "P1_SPEC_FORMING",
      "phaseConfidence": "MEDIUM",
      "status": "REASSESS",
      "waitTrigger": null,
      "valueNow": ["MAPPING", "READINESS"],
      "valueNext": ["INTEGRATION", "CONFORMANCE", "VERTICAL_WORKFLOW"],
      "informationValue": "HIGH",
      "currentStartupValue": "LOW",
      "observedAt": "2026-08-13T15:29:23Z",
      "dependencyRefs": [],
      "ecosystemRefs": [],
      "ideaRefs": ["idea-277"],
      "sourceRefs": ["s225", "s226", "s227", "s228"]
    },
    {
      "marketId": "market-eu-public-procurement-digital-rails",
      "name": "EU public-procurement data, qualification, and submission rails",
      "phase": "P6_OPERATIONAL_SCALE",
      "phaseConfidence": "HIGH",
      "status": "REASSESS",
      "waitTrigger": null,
      "valueNow": ["EXCEPTION_HANDLING", "AUDIT", "VERTICAL_WORKFLOW"],
      "valueNext": ["OPTIMIZATION", "ANALYTICS"],
      "informationValue": "HIGH",
      "currentStartupValue": "LOW",
      "observedAt": "2026-08-13T15:29:23Z",
      "dependencyRefs": [],
      "ecosystemRefs": [],
      "ideaRefs": ["idea-265"],
      "sourceRefs": ["s235", "s236"]
    },
    {
      "marketId": "market-eu-non-euro-vop",
      "name": "EU non-euro-area Verification of Payee implementation",
      "phase": "P2_PREPARATION",
      "phaseConfidence": "HIGH",
      "status": "REASSESS",
      "waitTrigger": null,
      "valueNow": ["READINESS", "CONFORMANCE", "CERTIFICATION"],
      "valueNext": ["CUTOVER", "EXCEPTION_HANDLING", "OBSERVABILITY", "AUDIT"],
      "informationValue": "HIGH",
      "currentStartupValue": "LOW",
      "observedAt": "2026-08-13T16:05:00Z",
      "dependencyRefs": [],
      "ecosystemRefs": [],
      "ideaRefs": ["idea-304"],
      "sourceRefs": ["s241", "s242"]
    },
    {
      "marketId": "market-eu-cloud-switching-continuity",
      "name": "EU cloud switching, reversibility, and operational continuity",
      "phase": "P5_CONFORMANCE",
      "phaseConfidence": "HIGH",
      "status": "REASSESS",
      "waitTrigger": null,